{"contentTrust":"reviewer-authored-data","findings":[{"body":"Summary: Git author/committer identity is forgeable by the autonomous executor, so non-bot human cannot be inferred from local metadata. Recommended plan change: require a named non-spoofable signal such as verified allowlisted signature or protected-branch approval bound to candidate SHA; otherwise narrow REQ-4 to human review policy.","component":"architecture-notes","references":["REQ-4","RISK-5","assets/decisions.md","plan.md step 1.1"],"rootCause":"human-authority-provenance","severity":"High","taskId":"security-m1","title":"Lock-authority gate verifies a self-asserted commit actor"},{"body":"Summary: Transition checks cannot run in plain local/shallow/first-push contexts, but no fail/degraded contract exists. Recommended plan change: split always-on digest validation from one-blob transition authority, fail when required base cannot be supplied, and test both explicit digest-only and unavailable-base outcomes.","component":"architecture-notes","references":["REQ-4","RISK-5","plan.md steps 1.1 and 1.3"],"rootCause":"human-authority-input-contract","severity":"High","taskId":"security-m1","title":"Authority gate lacks behavior when base state is unavailable"},{"body":"Summary: State file paths are schema-valid but recorded entries are used for stat/remedy without explicit re-confinement, enabling disclosure or misleading manual deletion guidance. Recommended plan change: re-confine every recorded path before stat/output/transition and add hostile traversal/rooted/reparse state fixtures with no outside path echo.","component":"retirement-security","references":["RISK-2","assets/decisions/retirement-protocol.md","plan.md steps 2.1 and 2.3"],"rootCause":"untrusted-retirement-state","severity":"Medium","taskId":"security-m1","title":"Retirement state contents are not treated as untrusted"},{"body":"Summary: A forged same-source receipt and preview can name an unmanaged in-bound .github file because tombstones do not pin authorized payload paths/hashes. Recommended plan change: tombstone-pin immutable destination/hash authority per source/ref/version and delete only the exact intersection; legacy/unknown sets become manual-required; test forged receipts targeting unmanaged and other-plugin files.","component":"retirement-security","references":["REQ-7","REQ-8","assets/decisions/retirement-protocol.md","plan.md steps 1.3 and 2.1-2.2"],"rootCause":"retirement-deletion-authority","severity":"High","taskId":"security-m2","title":"Mutable receipts can widen automatic deletion authority"},{"body":"Summary: Human-like commit metadata or a human actor pushing agent output does not prove approval of the exact SHA. Recommended plan change: bind verified signature/allowlisted identity or protected-branch human approval to the exact candidate SHA, rejecting spoofed metadata, bot actors, stale approvals, and missing evidence.","component":"architecture-notes","references":["REQ-4","assets/decisions.md","plan.md step 1.1"],"rootCause":"human-authority-provenance","severity":"High","taskId":"security-m2","title":"Human lock authority has no trustworthy authorization signal"},{"body":"Summary: The new gate can require unbounded history walks/API calls outside the suite budget. Recommended plan change: use one explicitly materialized base blob per changed contract plus CI event/head actor metadata, prohibit unshallow ancestry walks, and fail closed when inputs are unavailable.","component":"architecture-notes","references":["assets/decisions.md","docs/design-notes/project/ci-gates.design.md","plan.md steps 1.1 and 3.3"],"rootCause":"human-authority-input-contract","severity":"Medium","taskId":"performance-m1","title":"Always-on authority gate has no materialization or actor-resolution cost bound"},{"body":"Summary: Permanent states can stat unbounded paths and emit one record per plugin on every operation; small suite fixtures do not bound growth. Recommended plan change: impose a global per-invocation plugin/path replay budget with persisted cursor, aggregate bounded output, no hashing, fairness, and a scale fixture proving eventual sweep.","component":"retirement-performance","references":["REQ-7","RISK-8","assets/decisions/retirement-protocol.md","plan.md steps 2.1 and 2.3"],"rootCause":"residue-replay-unbounded","severity":"Medium","taskId":"performance-m2","title":"Residue replay caps records but not total recurring work"},{"body":"Summary: REQ-1 maps to 1.3/3.1/3.2 while actual retirement/proof lives in 2.3/3.2/3.3. Recommended plan change: set REQ-1 Phases/Steps to 2.3, 3.2, 3.3.","component":"plan-evidence","references":["REQ-1","plan.md steps 1.3, 2.3, 3.1, 3.3"],"rootCause":"requirement-step-mapping","severity":"Low","taskId":"testing-evidence-m1","title":"REQ-1 step mapping contradicts step annotations"},{"body":"Summary: Current markers already pass and prove neither immutable fixture reuse nor removal of 34088e's duplicate protocol matrix. Recommended plan change: use post-edit-only markers/tests naming the exact fixture and explicit ownership text; edit 34088e REQ-5, step 4.1, and related risks.","component":"cross-plan-ownership","references":["34088e plan.md, requirements.md, references.md","cda9da REQ-7 and step 3.2"],"rootCause":"consumer-plan-evidence-already-green","severity":"High","taskId":"testing-evidence-m1","title":"REQ-7 cross-plan evidence is already green"},{"body":"Summary: Architecture-notes evals and locked fixtures assert lockedBodySha256 and go red when 1.1 changes the closed schema. Recommended plan change: update the surviving eval and canonical/dogfood fixtures to lockedContentSha256 in step 1.1, preserving explicit missing/bad/valid digest cases.","component":"architecture-notes","references":["REQ-4","RISK-6","plan.md steps 1.1, 1.2, 2.3","plugins/architecture-notes/evals/architecture-notes.Tests.ps1"],"rootCause":"schema-eval-sequencing","severity":"High","taskId":"testing-evidence-m1","title":"Schema change has no same-step surviving-eval update"},{"body":"Summary: Requiring the manifest file to remain byte-identical detects no edits to listed historical files. Recommended plan change: rehash every listed path, assert a non-zero expected count, and prove red on one listed-file mutation plus empty/zero-entry manifest.","component":"historical-evidence","references":["REQ-6","RISK-7","plan.md steps 1.1 and 3.2"],"rootCause":"historical-manifest-self-check","severity":"High","taskId":"testing-evidence-m1","title":"Historical immutability compares the frozen manifest to itself"},{"body":"Summary: Changed/removed/name-reuse fixtures do not falsify CI materialization failure or distinguish first publication. Recommended plan change: define missing/empty/malformed refusal and explicit first-publication handling, then execute the workflow's unavailable-baseline path expecting nonzero.","component":"registry-retirement","references":["REQ-2","RISK-4","plan.md step 1.3"],"rootCause":"tombstone-baseline-contract","severity":"Medium","taskId":"testing-evidence-m1","title":"Permanence gate lacks unavailable or empty baseline proof"},{"body":"Summary: REQ-3 evidence starts at 3.1 although the false-green risk is created in 1.2 and old tests are deleted in 2.3. Recommended plan change: add 1.2 to REQ-3 ownership and prove canonical mixed-marker refusal before evaluator removal; make 3.1 own only later cleanup/bundle matrix.","component":"plan-evidence","references":["REQ-3","RISK-4","plan.md steps 1.2, 2.3, 3.1"],"rootCause":"mixed-marker-sequencing","severity":"Medium","taskId":"testing-evidence-m1","title":"Arch evaluator removal has no same-step mixed-marker evidence"},{"body":"Summary: The eight outcomes lack exhaustive mutation/state/continuation/cardinality/exit semantics, and at-most-one record permits silence. Recommended plan change: add an exhaustive table and require ReaderRemovalAndResultContract to enumerate every row, reject unknowns, and prove exactly one record for matched, blocked, or recovered plugins.","component":"retirement-results","references":["REQ-8","assets/decisions/retirement-protocol.md","plan.md step 2.3"],"rootCause":"outcome-exit-semantics","severity":"High","taskId":"testing-evidence-m2","title":"Outcome-to-exit contract remains incomplete"},{"body":"Summary: Dependency and prose markers pass before implementation, while step 4.1 does not identify cda9da's immutable fixture. Recommended plan change: assign a stable fixture ID/path, require exact references in 34088e step 4.1 and REQ-5, and add test:PluginRetirement.ConsumerPlanConsumption that fails today.","component":"cross-plan-ownership","references":["34088e step 4.1 and references","cda9da REQ-7 and step 3.2"],"rootCause":"consumer-plan-evidence-already-green","severity":"High","taskId":"testing-evidence-m2","title":"34088e consumption evidence is already green without fixture reuse"},{"body":"Summary: Comparator unit fixtures cannot prove PR/push workflow invocation, exactly one baseline, failure propagation, or inventory registration. Recommended plan change: add gate:plugin-retirement-history plus test:Ci.PluginRetirementHistoryGate inspecting both event paths and executing unavailable materialization expecting nonzero.","component":"ci-gates","references":["REQ-2","docs/design-notes/project/ci-gates.design.md","plan.md step 1.3"],"rootCause":"ci-gate-inventory-ownership","severity":"Medium","taskId":"testing-evidence-m2","title":"One-blob CI wiring lacks a falsifying gate test"},{"body":"Summary: Phase 1 publishes no tombstone, while Phase 2 performs the irreversible retirement and deletion under a non-destructive title. Recommended plan change: rename Phase 1 for fixtures/authority/mechanism and Phase 2 for retirement publication and subsystem deletion.","component":"plan-structure","references":["plan.md Phase 1","plan.md Phase 2"],"rootCause":"phase-title-mismatch","severity":"Low","taskId":"architecture-patterns-m1","title":"Phase titles hide t